wikipedia-video-game	PUBLISHER	any-wikipedia-video-game is an any-wikipedia-company videogame that belongs to the any-wikipedia-video-game-series	Need for Speed: Carbon	Need For Speed: Carbon is an Electronic Arts videogame that belongs to the Need for Speed series.	Electronic Arts
wikipedia-vice-president	PRESIDENT	any-wikipedia-vice-president was a member of the Republican Party and served with President William any-wikipedia-given-name any-wikipedia-river	James S. Sherman	Sherman was a member of the Republican Party, and served with President William Howard Taft.	William Howard Taft
wikipedia-french-commune	DEPARTMENT	any-wikipedia-french-commune is a commune of the any-wikipedia-department departement in the southwestern part of any-wikipedia-country	Arbonne	Arbonne is a commune of the Pyrenees-Atlantiques departement in the southwestern part of France.	Pyrenees-Atlantiques
wikipedia-uk-place	COUNTRY	any-wikipedia-uk-place used to be the capital of the Kingdom of any-wikipedia-country	Stirling	It used to be the capital of the Kingdom of Scotland.	Scotland
wikipedia-country	OFFICIAL-LANGUAGES	any-wikipedia-country is a member state of the African Union the any-wikipedia-geopolitical-organization-one the any-wikipedia-geopolitical-organization-two any-wikipedia-organization and the any-wikipedia-geopolitical-organization-three	Angola	Angola is a member state of the African Union, the Community of Portuguese Language Countries, the Latin Union, South Atlantic Peace and Cooperation Zone and the Southern African Development Community.	Portuguese
wikipedia-grandslamtournaments	CITY	any-wikipedia-grandslamtournaments is played in any-wikipedia-australian-place	Australian Open	It is played in Melbourne, Australia.	Melbourne
wikipedia-musical-artist	CURRENT-MEMBERS	any-wikipedia-musical-artist has written any-number songs	Dave Matthews Band	Dave Matthews Band has written 235 songs .	Dave Matthews
wikipedia-person	RELATIVES	any-wikipedia-person's brothers and sisters are any-wikipedia-person-one any-wikipedia-person-two any-wikipedia-person-three any-wikipedia-person-four and his twin brother, Jacob Fiennes	Joseph Fiennes	His brothers and sisters are Ralph Fiennes, Sophie Fiennes, Martha Fiennes, Magnus Fiennes and his twin brother, Jacob Fiennes.	Magnus Fiennes
wikipedia-football-biography	NATIONALTEAM	any-wikipedia-football-biography has played for the Brazil national team	Juninho Paulista	He has played for the Brazil national team.	Brazil
wikipedia-airport	PUSHPIN-MAP	any-wikipedia-airport served any-number passengers in any-date-one and any-number passengers in any-date-two, more than a half of total passengers in any-wikipedia-country's airports	Tan Son Nhat International Airport	It served 8.5 million passengers in 2006 and 11 million passengers in 2007, more than a half of total passengers in Vietnam's airports.	Vietnam
wikipedia-french-commune	DEPARTMENT	any-wikipedia-french-commune is a commune of the any-wikipedia-department departement in the southwestern part of any-wikipedia-country	Arbouet-Sussaute	Arbouet-Sussaute is a commune of the Pyrenees-Atlantiques departement in the southwestern part of France.	Pyrenees-Atlantiques
wikipedia-country	LANGUAGES-TYPE	The most important languages spoken in any-wikipedia-country are any-wikipedia-language-one and any-wikipedia-language-two	Tokelau	The most important languages spoken in Tokelau are English and Tokelauan.	languages
wikipedia-country	POPULATION-ESTIMATE	any-wikipedia-country's population is estimated to be any-number	Angola	Angola's population is estimated to be 18,498,000 .	18,498,000
wikipedia-president	NATIONALITY	any-wikipedia-president took part of the any-wikipedia-military-conflict	Urho Kekkonen	He took part of the Finnish Civil War.	Finnish
wikipedia-person	RELATIVES	any-wikipedia-person's brothers and sisters are any-wikipedia-person-one any-wikipedia-person-two any-wikipedia-person-three any-wikipedia-person-four and his twin brother, Jacob Fiennes	Joseph Fiennes	His brothers and sisters are Ralph Fiennes, Sophie Fiennes, Martha Fiennes, Magnus Fiennes and his twin brother, Jacob Fiennes.	Ralph Fiennes
wikipedia-football-biography	NATIONALTEAM	any-wikipedia-football-biography has played for Brazil national team	Mauro Silva	He has played for Brazil national team.	Brazil
wikipedia-musical-artist	CURRENT-MEMBERS	any-wikipedia-musical-artist is a band from the any-wikipedia-country	Dave Matthews Band	Dave Matthews Band is a band from the United States.	Dave Matthews
wikipedia-athlete	NATIONALITY	any-wikipedia-given-name-revised any-wikipedia-uk-constituency-main any-wikipedia-athlete is an American retired track and field athlete	Carl Lewis	Frederick Carlton "Carl" Lewis is an American retired track and field athlete.	American
wikipedia-country	LARGEST-CITY	any-wikipedia-country is divided into any-number provinces and the capital city of any-wikipedia-settlement	Armenia	Armenia is divided into ten provinces and the capital city of Yerevan.	capital
wikipedia-person	BIRTH-PLACE	any-wikipedia-person was born on any-date in any-wikipedia-uk-place any-wikipedia-country	Joseph Fiennes	He was born on 27 May 1970 in Salisbury, Wiltshire, England.	Salisbury, Wiltshire, England
wikipedia-football-biography	NATIONALTEAM	any-wikipedia-football-biography has played for Brazil national team	Bebeto	He has played for Brazil national team.	Brazil
wikipedia-scientist	NATIONALITY	any-wikipedia-scientist was an any-wikipedia-language ornithologist	John Gould	John Gould was an English ornithologist .	English
wikipedia-officeholder	PRESIDENT	any-wikipedia-officeholder-one took office on any-date-one under any-wikipedia-officeholder-two and any-wikipedia-officeholder-three's administrations until his retirement on any-date-two Prior to this Gates served for 26 any-number in the any-wikipedia-government-agency-one and the any-wikipedia-government-agency-two	Robert Gates	He took office on December 18, 2006 under George W. Bush and Barack Obama's administrations until his retirement on July 1, 2011 Prior to this, Gates served for 26 years in the Central Intelligence Agency and the United States National Security Council.	Barack Obama
wikipedia-french-commune	DEPARTMENT	any-wikipedia-french-commune is a commune of the any-wikipedia-department departement in the southwestern part of any-wikipedia-country	Arberats-Sillegue	Arberats-Sillegue is a commune of the Pyrenees-Atlantiques departement in the southwestern part of France.	Pyrenees-Atlantiques
wikipedia-settlement	PUSHPIN-LABEL	The any-wikipedia-arena-football-league-team are an football team with the any-wikipedia-sports-league in any-wikipedia-settlement	Orlando, Florida	The Orlando Predators are an football team with the Arena Football League in Orlando.	Orlando
wikipedia-country	ESTABLISHED-EVENT	In any-date-one the Kingdom of any-wikipedia-country-one covered parts of what is any-date-two any-wikipedia-country-two any-wikipedia-country-three any-wikipedia-country-four any-wikipedia-country-five any-wikipedia-country-six any-wikipedia-country-seven and of course any-wikipedia-country-one	Armenia	In 80 BC, the Kingdom of Armenia covered parts of what is today Turkey, Syria, Lebanon, Iran, Iraq, Azerbaijan, and, of course, Armenia.	Kingdom of Armenia
wikipedia-person	PARENTS	any-wikipedia-person's parents were any-wikipedia-person-one and any-wikipedia-person-two	Joseph Fiennes	His parents were Jennifer Lash and Mark Fiennes.	Jennifer Lash
wikipedia-swiss-town	CANTON	any-wikipedia-swiss-town-one is the capital of the Wahlkreis of any-wikipedia-swiss-town-one in the canton of St Gallen in any-wikipedia-country	Wil	Wil is the capital of the Wahlkreis of Wil in the canton of St. Gallen in Switzerland.	St. Gallen
wikipedia-scientist	INFLUENCES	any-wikipedia-scientist's knowledge of the birds now called "Darwin's finches" was a turning point in the any-wikipedia-scientist's thinking about evolution by natural selection	John Gould	His knowledge of the birds now called "Darwin's finches" was a turning point in the Charles Darwin's thinking about evolution by natural selection.	Charles Darwin
wikipedia-officeholder	PRESIDENT	Under President George H W Bush any-wikipedia-officeholder served as Director of Central Intelligence	Robert Gates	Under President George H. W. Bush, Gates served as Director of Central Intelligence.	George H. W. Bush
wikipedia-french-commune	DEPARTMENT	any-wikipedia-french-commune is a commune of the any-wikipedia-department departement in the southwestern part of any-wikipedia-country	Arcangues	Arcangues is a commune of the Pyrenees-Atlantiques departement in the southwestern part of France.	Pyrenees-Atlantiques
wikipedia-royalty	TITLE	any-wikipedia-royalty was the any-ordinal any-infobox of the any-wikipedia-former-country	Suleiman the Magnificent	Suleiman I , was the tenth Sultan of the Ottoman Empire.	Sultan of the Ottoman Empire
wikipedia-person	PARENTS	any-wikipedia-person's parents were any-wikipedia-person-one and any-wikipedia-person-two	Joseph Fiennes	His parents were Jennifer Lash and Mark Fiennes.	Mark Fiennes
wikipedia-swiss-town	CANTON	any-wikipedia-swiss-town-one is a municipality of the Wahlkreis of any-wikipedia-swiss-town-two in the canton of St Gallen in any-wikipedia-country	Uzwil	Uzwil is a municipality of the Wahlkreis of Wil in the canton of St. Gallen in Switzerland.	St. Gallen
wikipedia-military-person	BIRTH-PLACE	any-wikipedia-military-person was born on any-date at any-wikipedia-australian-place	Mark Donaldson	Mark Donaldson was born on 2 April, 1979 at Waratah, New South Wales.	Waratah, New South Wales
wikipedia-officeholder	TERM-START	any-wikipedia-officeholder-one took office on any-date-one under any-wikipedia-officeholder-two and any-wikipedia-officeholder-three's administrations until his retirement on any-date-two Prior to this Gates served for 26 any-number in the any-wikipedia-government-agency-one and the any-wikipedia-government-agency-two	Robert Gates	He took office on December 18, 2006 under George W. Bush and Barack Obama's administrations until his retirement on July 1, 2011 Prior to this, Gates served for 26 years in the Central Intelligence Agency and the United States National Security Council.	December 18, 2006
wikipedia-french-commune	DEPARTMENT	any-wikipedia-french-commune is a commune of the any-wikipedia-department departement in the southwestern part of any-wikipedia-country	Aressy	Aressy is a commune of the Pyrenees-Atlantiques departement in the southwestern part of France.	Pyrenees-Atlantiques
wikipedia-person	RELATIVES	any-wikipedia-person's brothers and sisters are any-wikipedia-person-one any-wikipedia-person-two any-wikipedia-person-three any-wikipedia-person-four and his twin brother, Jacob Fiennes	Joseph Fiennes	His brothers and sisters are Ralph Fiennes, Sophie Fiennes, Martha Fiennes, Magnus Fiennes and his twin brother, Jacob Fiennes.	Martha Fiennes
wikipedia-royalty	SUCCESSION	any-wikipedia-royalty was the any-ordinal any-infobox of the any-wikipedia-former-country	Suleiman the Magnificent	Suleiman I , was the tenth Sultan of the Ottoman Empire.	Sultan of the Ottoman Empire
wikipedia-vg	PLATFORMS	any-wikipedia-vg is only available for the PlayStation any-number	MotorStorm	It is only available for the PlayStation 3.	PlayStation 3
wikipedia-football-biography	NATIONALTEAM	any-wikipedia-football-biography has played for any-wikipedia-country national team	David Bisconti	He has played for Argentina national team.	Argentina
wikipedia-officeholder	PRESIDENT	any-wikipedia-officeholder-one took office on any-date-one under any-wikipedia-officeholder-two and any-wikipedia-officeholder-three's administrations until his retirement on any-date-two Prior to this Gates served for 26 any-number in the any-wikipedia-government-agency-one and the any-wikipedia-government-agency-two	Robert Gates	He took office on December 18, 2006 under George W. Bush and Barack Obama's administrations until his retirement on July 1, 2011 Prior to this, Gates served for 26 years in the Central Intelligence Agency and the United States National Security Council.	George W. Bush
wikipedia-french-commune	DEPARTMENT	any-wikipedia-french-commune is a commune of the any-wikipedia-department departement in the southwestern part of any-wikipedia-country	Arette	Arette is a commune of the Pyrenees-Atlantiques departement in the southwestern part of France.	Pyrenees-Atlantiques
wikipedia-airport	PUSHPIN-MAP	any-wikipedia-airport is an airport in any-wikipedia-settlement	Tan Son Nhat International Airport	Tan Son Nhat International Airport is an airport in Ho Chi Minh City, Vietnam.	Vietnam
wikipedia-german-location	BUNDESLAND	any-wikipedia-german-location-one is a municipality in the district of any-wikipedia-german-location-two in any-wikipedia-german-bundesland	Quickborn, Dithmarschen	Quickborn is a municipality in the district of Dithmarschen, in Schleswig-Holstein, Germany.	Schleswig-Holstein
wikipedia-album	ARTIST	any-wikipedia-album is the any-ordinal studio album by Irish rock band any-wikipedia-musical-artist	Achtung Baby	Achtung Baby is the seventh studio album by Irish rock band U2.	U2
wikipedia-football-biography	NATIONALTEAM	any-wikipedia-football-biography has played for any-wikipedia-country national team	Yoshihiro Natsuka	He has played for Japan national team.	Japan
wikipedia-vice-president	TERM-END	any-wikipedia-vice-president was in office from any-date-one to any-date-two	James S. Sherman	He was in office from March 4, 1909 to October 30, 1912.	March 4, 1909
wikipedia-officeholder	TERM-END	any-wikipedia-officeholder-one took office on any-date-one under any-wikipedia-officeholder-two and any-wikipedia-officeholder-three's administrations until his retirement on any-date-two Prior to this Gates served for 26 any-number in the any-wikipedia-government-agency-one and the any-wikipedia-government-agency-two	Robert Gates	He took office on December 18, 2006 under George W. Bush and Barack Obama's administrations until his retirement on July 1, 2011 Prior to this, Gates served for 26 years in the Central Intelligence Agency and the United States National Security Council.	July 1, 2011
wikipedia-french-commune	DEPARTMENT	any-wikipedia-french-commune is a commune of the any-wikipedia-department departement in the southwestern part of any-wikipedia-country	Argagnon	Argagnon is a commune of the Pyrenees-Atlantiques departement in the southwestern part of France.	Pyrenees-Atlantiques
wikipedia-historic-site	LOCATION	any-wikipedia-historic-site is an island near any-wikipedia-settlement	Ellis Island	Ellis Island is an island near New York City.	New York City
wikipedia-president	NATIONALITY	any-wikipedia-president studied law and then worked in the Finnish secret police	Urho Kekkonen	He studied law and then worked in the Finnish secret police.	Finnish
wikipedia-german-location	KREIS	any-wikipedia-german-location-one is a municipality in the district of any-wikipedia-german-location-two in any-wikipedia-german-bundesland	Quickborn, Dithmarschen	Quickborn is a municipality in the district of Dithmarschen, in Schleswig-Holstein, Germany.	Dithmarschen
wikipedia-album	ARTIST	any-wikipedia-album shows a very big change in any-wikipedia-musical-artist's sound because they began to use alternative rock and electronic sounds in the rhythm more production and more guitar effects also including darker and more personal song words	Achtung Baby	Achtung Baby shows a very big change in U2's sound because they began to use alternative rock and electronic sounds in the rhythm, more production, and more guitar effects, also including darker and more personal song words.	U2
wikipedia-book	AUTHOR	any-wikipedia-book is a book written by any-wikipedia-writer	Just Ella	Just Ella is a book written by Margaret Peterson Haddix.	Margaret Peterson Haddix
wikipedia-football-biography	YOUTHCLUBS	any-wikipedia-football-biography is playing for any-wikipedia-settlement and the any-wikipedia-national-football-team	Carles Puyol	He is playing for Barcelona and the Spain national team.	Barcelona
wikipedia-file-format	MIME	any-wikipedia-file-format is a computer file format for word processors presentation software and other computer programs	OpenDocument	OpenDocument Format is a computer file format for word processors, presentation software and other computer programs.	presentation
wikipedia-french-commune	DEPARTMENT	any-wikipedia-french-commune is a commune of the any-wikipedia-department departement in the southwestern part of any-wikipedia-country	Arget	Arget is a commune of the Pyrenees-Atlantiques departement in the southwestern part of France.	Pyrenees-Atlantiques
wikipedia-president	ORDER	any-wikipedia-president was also any-wikipedia-official-post before that	Urho Kekkonen	He was also Prime Minister of Finland before that.	Prime Minister of Finland
wikipedia-us-cabinet-official	TITLE	any-wikipedia-us-cabinet-official was a any-wikipedia-political-post-one and the any-ordinal any-wikipedia-political-post-two	James Forrestal	James Vincent Forrestal was a United States Secretary of the Navy and the first United States Secretary of Defense.	United States Secretary of Defense
wikipedia-country	OFFICIAL-LANGUAGES	The Armenian name for any-wikipedia-country means any-wikipedia-film of Haik	Armenia	The Armenian name for Armenia means Land of Haik.	Armenian
wikipedia-film	DIRECTOR	any-wikipedia-film-one was the any-ordinal movie in any-wikipedia-person's The any-wikipedia-film-two Trilogy	Batman Begins	Batman Begins was the first movie in Christopher Nolan's The Dark Knight Trilogy.	Christopher Nolan
wikipedia-football-biography	CURRENTCLUB	any-wikipedia-football-biography is playing for any-wikipedia-settlement and the any-wikipedia-national-football-team	Carles Puyol	He is playing for Barcelona and the Spain national team.	Barcelona
wikipedia-french-commune	DEPARTMENT	any-wikipedia-french-commune is a commune of the any-wikipedia-department departement in the southwestern part of any-wikipedia-country	Arhansus	Arhansus is a commune of the Pyrenees-Atlantiques departement in the southwestern part of France.	Pyrenees-Atlantiques
wikipedia-settlement	DEMOGRAPHICS1-INFO	any-wikipedia-settlement-one connected by road to major cities of any-wikipedia-state-one including any-wikipedia-settlement-two any-wikipedia-settlement-three any-wikipedia-settlement-four any-wikipedia-settlement-five any-wikipedia-settlement-six and also to other states such as any-wikipedia-state-two and any-wikipedia-state-three	Oddanchatram	It connected by road to major cities of Tamil Nadu including Madurai, Coimbatore, Erode, Trichy, Chennai, and also to other states such as Andhra Pradesh and Karnataka.	Tamil
wikipedia-president	PREDECESSOR	any-wikipedia-president-one tried to keep good relations with the any-wikipedia-former-country like president any-wikipedia-president-two	Urho Kekkonen	He tried to keep good relations with the Soviet Union like president Juho Kusti Paasikivi.	Juho Kusti Paasikivi
wikipedia-file-format	MIME	For example OpenOffice is a program that uses any-wikipedia-file-format to save text slideshows and spreadsheets	OpenDocument	For example, OpenOffice is a program that uses ODF to save text, slideshows and spreadsheets.	text
wikipedia-color	TEXTCOLOR	any-wikipedia-color along with gray and white is a neutral color	Black	Black, along with gray and white, is a neutral color.	white
wikipedia-us-cabinet-official	TITLE	any-wikipedia-us-cabinet-official was a any-wikipedia-political-post-one and the any-ordinal any-wikipedia-political-post-two	James Forrestal	James Vincent Forrestal was a United States Secretary of the Navy and the first United States Secretary of Defense.	United States Secretary of the Navy
wikipedia-person	NATIONALITY	Sir Maurice Joseph Micklewhite, Jr any-wikipedia-order known by the artistic name any-wikipedia-person is a popular any-wikipedia-language movie actor	Michael Caine	Sir Maurice Joseph Micklewhite, Jr. CBE , known by the artistic name Michael Caine, is a popular English movie actor.	English
wikipedia-football-biography	CLUBS	any-wikipedia-football-biography is playing for any-wikipedia-settlement and the any-wikipedia-national-football-team	Carles Puyol	He is playing for Barcelona and the Spain national team.	Barcelona
wikipedia-military-person	UNIT	any-wikipedia-military-person was then posted to any-ordinal Battalion, Royal Australian Regiment based at any-wikipedia-australian-place	Mark Donaldson	He was then posted to 1st Battalion, Royal Australian Regiment, based at Townsville, Queensland.	1st Battalion, Royal Australian Regiment
wikipedia-mlb-player	DEBUTTEAM	any-wikipedia-mlb-player was with the any-wikipedia-mlb from any-date-one to any-date-two, and was an All-Star twice for the Royals	Joakim Soria	He was with the Kansas City Royals from 2007 to 2012, and was an All-Star twice for the Royals.	Kansas City Royals
wikipedia-university	STATE	any-wikipedia-university is a private university in Chestnut Hill, Massachusetts	Boston College	Boston College is a private university in Chestnut Hill, Massachusetts.	Massachusetts
wikipedia-country	GDP-NOMINAL-RANK	While any-wikipedia-country achieved many things in the First millennium and early any-ordinal millennium it became an isolationist country in the any-date any-wikipedia-planet any-wikipedia-animanga\/video	China	While China achieved many things in the First millennium and early 2nd millennium, it became an isolationist country in the 15th century C.E.	2nd
wikipedia-rugby-biography	RU-PROCLUBS	any-wikipedia-rugby-biography is a rugby union player for any-wikipedia-rugby-team in the any-wikipedia-rugby-league-cup	David Blaney	David Blaney is a rugby union player for Bristol Rugby in the Guinness Premiership.	Bristol Rugby
wikipedia-military-unit	COMMAND-STRUCTURE	any-wikipedia-military-unit is part of the any-wikipedia-national-military	Royal Australian Navy	It is part of the Australian Defence Force.	Australian Defence Force
wikipedia-football-biography	NATIONALTEAM	any-wikipedia-football-biography is playing for any-wikipedia-settlement and the any-wikipedia-national-football-team	Carles Puyol	He is playing for Barcelona and the Spain national team.	Spain
wikipedia-military-person	AWARDS	any-wikipedia-military-person is an any-wikipedia-military-unit who was given the any-ordinal any-wikipedia-military-award	Mark Donaldson	Mark Donaldson is an Australian soldier who was given the first Victoria Cross for Australia.	Victoria Cross for Australia
wikipedia-us-cabinet-official	BRANCH	any-wikipedia-us-cabinet-official served as the any-wikipedia-political-post during World War II	George Marshall	Marshall served as the United States Army Chief of Staff during World War II.	United States Army
wikipedia-president	ORDER	After Second World War in the any-date any-wikipedia-president became the any-ordinal time any-wikipedia-official-post	Urho Kekkonen	After Second World War, in the year 1950 Kekkonen became the first time Prime Minister of Finland.	Prime Minister of Finland
wikipedia-rugby-union-biography	BIRTH-PLACE	any-wikipedia-rugby-union-biography born any-date in any-wikipedia-country is a rugby union player for any-wikipedia-rugby-team in the any-wikipedia-rugby-league-cup	Ryan Prosser	Ryan Prosser born 10 July, 1988 in Wales is a rugby union player for Bristol Rugby in the Guinness Premiership.	Wales
wikipedia-mlb-player	TEAM	any-wikipedia-mlb-player is a any-wikipedia-sports-league relief pitcher for the any-wikipedia-mlb	Joakim Soria	Joakim Soria is a Major League Baseball relief pitcher for the Texas Rangers.	Texas Rangers
wikipedia-military-unit	TYPE	The head of the any-wikipedia-military-unit is the any-wikipedia-musical-artist presently any-wikipedia-royalty	Royal Australian Navy	The head of the Royal Australian Navy is the Monarch presently Queen Elizabeth II.	Navy
wikipedia-athletic-conference	ASSOCIATION	any-wikipedia-athletic-conference-one officially abbreviated any-wikipedia-athletic-conference-two is a group of college sports teams that play each other on the NCAA Division I level	Conference USA	Conference USA, officially abbreviated C-USA, is a group of college sports teams that play each other on the NCAA Division I level.	NCAA
wikipedia-settlement	PUSHPIN-MAP	any-wikipedia-settlement-one or any-wikipedia-settlement-two is a city in the west of any-wikipedia-country any-wikipedia-continent	Grodno	Grodno or Hrodna is a city in the west of Belarus, Europe.	Belarus
wikipedia-settlement	SUBDIVISION-TYPE	The any-wikipedia-settlement is an historic region of any-wikipedia-country	Scottish Highlands	The Scottish Highlands is an historic region of Scotland.	Scotland
wikipedia-website	LANGUAGE	The any-wikipedia-website-one is the Czech-language edition of any-wikipedia-website-two	Czech Wikipedia	The Czech Wikipedia is the Czech-language edition of Wikipedia.	Czech
wikipedia-rugby-biography	RU-CURRENTTEAM	any-wikipedia-rugby-biography is a rugby union player for any-wikipedia-rugby-team in the any-wikipedia-rugby-league-cup	Iain Grieve	Iain Grieve is a rugby union player for Bristol Rugby in the Guinness Premiership.	Bristol Rugby
wikipedia-president	HONORIFIC-PREFIX	any-wikipedia-president-one was elected the President of any-wikipedia-country in any-date, after president any-wikipedia-president-two	Urho Kekkonen	Kekkonen was elected the President of Finland in 1956, after president Paasikivi.	President
wikipedia-athletic-conference	DIVISION	any-wikipedia-athletic-conference-one officially abbreviated any-wikipedia-athletic-conference-two is a group of college sports teams that play each other on the NCAA Division I level	Conference USA	Conference USA, officially abbreviated C-USA, is a group of college sports teams that play each other on the NCAA Division I level.	Division I
