wikipedia-country	OFFICIAL-LANGUAGES	any-wikipedia-country is the only country in any-wikipedia-continent that speaks Portuguese	Brazil	Brazil is the only country in Latin America that speaks Portuguese.	Portuguese
wikipedia-uk-place	SHIRE-COUNTY	any-wikipedia-uk-place is a town in any-wikipedia-england-county	Minehead	Minehead is a town in Somerset, England.	Somerset
wikipedia-prime-minister	OFFICE	any-wikipedia-prime-minister was the any-ordinal any-wikipedia-political-post from any-date-one until his death in any-date-two	Levi Eshkol	Levi Eshkol was the 3rd Prime Minister of Israel from 1963 until his death in 1969.	Prime Minister of Israel
wikipedia-settlement	TIMEZONE	any-wikipedia-settlement-one is the capital city of any-wikipedia-settlement-two in the north central coast of any-wikipedia-country	Dong Hoi	Dong Hoi is the capital city of Quang Binh province, in the north central coast of Vietnam.	Vietnam
wikipedia-uk-place	METROPOLITAN-BOROUGH	any-wikipedia-uk-place is a town in the Sandwell borough of the West Midlands, England with a population of around any-number	Tipton	Tipton is a town in the Sandwell borough of the West Midlands, England, with a population of around 47,000.	Sandwell
wikipedia-swiss-town	MUNICIPALITY-TYPE	any-wikipedia-swiss-town-one is a municipality of the district any-wikipedia-swiss-town-two in the canton of any-wikipedia-swiss-town-three in any-wikipedia-country	Allmendingen bei Bern	Allmendingen bei Bern is a municipality of the district Konolfingen in the canton of Bern in Switzerland.	municipality
wikipedia-swiss-town	DISTRICT	any-wikipedia-swiss-town-one is a municipality of the district any-wikipedia-swiss-town-two in the canton of any-wikipedia-canton in any-wikipedia-country	Indemini	Indemini is a municipality of the district Locarno in the canton of Ticino in Switzerland.	Locarno
wikipedia-french-commune	DEPARTMENT	any-wikipedia-french-commune is in the Dordogne departement in any-wikipedia-french-region	Monpazier	It is in the Dordogne departement, in Aquitaine.	Dordogne
wikipedia-french-commune	DEPARTMENT	any-wikipedia-french-commune is a commune of the any-wikipedia-department departement in the southwestern part of any-wikipedia-country	Angous	Angous is a commune of the Pyrenees-Atlantiques departement in the southwestern part of France.	Pyrenees-Atlantiques
wikipedia-islands	COUNTRY	any-wikipedia-islands-one is the largest island in the any-wikipedia-islands-two of any-wikipedia-country	New Britain	New Britain is the largest island in the Bismarck Archipelago of Papua New Guinea.	Papua New Guinea
wikipedia-writer	NATIONALITY	any-wikipedia-writer was an American screenwriter and novelist	Sidney Sheldon	Sidney Sheldon was an American screenwriter and novelist.	American
wikipedia-country	OFFICIAL-LANGUAGES	Most people in any-wikipedia-country speak Portuguese	Brazil	Most people in Brazil speak Portuguese.	Portuguese
wikipedia-uk-place	METROPOLITAN-COUNTY	any-wikipedia-uk-place is a town in the Sandwell borough of the West Midlands, England with a population of around any-number	Tipton	Tipton is a town in the Sandwell borough of the West Midlands, England, with a population of around 47,000.	West Midlands
wikipedia-swiss-town	CANTON	any-wikipedia-swiss-town-one is a municipality of the district any-wikipedia-swiss-town-two in the canton of any-wikipedia-swiss-town-three in any-wikipedia-country	Allmendingen bei Bern	Allmendingen bei Bern is a municipality of the district Konolfingen in the canton of Bern in Switzerland.	Bern
wikipedia-swiss-town	DISTRICT	any-wikipedia-swiss-town is a municipality of the district any-wikipedia-settlement in the canton of any-wikipedia-canton in any-wikipedia-country	Iragna	Iragna is a municipality of the district Riviera in the canton of Ticino in Switzerland.	Riviera
wikipedia-vice-president	TERM-START	any-wikipedia-vice-president was in office from any-date-one to any-date-two	James S. Sherman	He was in office from March 4, 1909 to October 30, 1912.	March 4, 1909
wikipedia-french-commune	DEPARTMENT	any-wikipedia-french-commune is a commune of the any-wikipedia-department departement in the southwestern part of any-wikipedia-country	Anoye	Anoye is a commune of the Pyrenees-Atlantiques departement in the southwestern part of France.	Pyrenees-Atlantiques
wikipedia-uk-place	COUNTRY	any-wikipedia-uk-place is a town in any-wikipedia-england-county	Minehead	Minehead is a town in Somerset, England.	England
wikipedia-settlement	PUSHPIN-MAP	any-wikipedia-settlement is home to any-wikipedia-islands's largest stadium any-wikipedia-stadium	Dublin	Dublin is home to Ireland's largest stadium, Croke Park.	Ireland
wikipedia-company	LOCATION-CITY	any-wikipedia-company is a major movie studio in any-wikipedia-australian-place	Fox Studios Australia	Fox Studios Australia is a major movie studio in Sydney, Australia.	Sydney
wikipedia-swiss-town	MUNICIPALITY-TYPE	any-wikipedia-swiss-town is a municipality of the district any-wikipedia-settlement in the canton of any-wikipedia-canton in any-wikipedia-country	Iragna	Iragna is a municipality of the district Riviera in the canton of Ticino in Switzerland.	municipality
wikipedia-vice-president	TERM-END	any-wikipedia-vice-president was in office from any-date-one to any-date-two	James S. Sherman	He was in office from March 4, 1909 to October 30, 1912.	October 30, 1912
wikipedia-uk-place	COUNTRY	any-wikipedia-uk-place is a town in the Sandwell borough of the West Midlands, England with a population of around any-number	Tipton	Tipton is a town in the Sandwell borough of the West Midlands, England, with a population of around 47,000.	England
wikipedia-person	SPOUSE	any-wikipedia-person-one was also once married to actress any-wikipedia-person-two in any-date	Hank Azaria	He was also once married to actress Helen Hunt in 1999.	Helen Hunt
wikipedia-settlement	PUSHPIN-MAP	any-wikipedia-settlement is the capital city of any-wikipedia-islands	Dublin	Dublin is the capital city of Ireland.	Ireland
wikipedia-french-commune	DEPARTMENT	any-wikipedia-french-commune is a commune of the any-wikipedia-department departement in the southwestern part of any-wikipedia-country	Aramits	Aramits is a commune of the Pyrenees-Atlantiques departement in the southwestern part of France.	Pyrenees-Atlantiques
wikipedia-company	LOCATION-COUNTRY	any-wikipedia-company is a major movie studio in any-wikipedia-australian-place	Fox Studios Australia	Fox Studios Australia is a major movie studio in Sydney, Australia.	Australia
wikipedia-swiss-town	CANTON	any-wikipedia-swiss-town is a municipality of the district any-wikipedia-settlement in the canton of any-wikipedia-canton in any-wikipedia-country	Iragna	Iragna is a municipality of the district Riviera in the canton of Ticino in Switzerland.	Ticino
wikipedia-vice-president	PRESIDENT	any-wikipedia-vice-president was a member of the Republican Party and served with President William any-wikipedia-given-name any-wikipedia-river	James S. Sherman	Sherman was a member of the Republican Party, and served with President William Howard Taft.	William Howard Taft
wikipedia-royalty	SUCCESSION	any-wikipedia-royalty-one or any-wikipedia-musical often known as any-wikipedia-royalty-two or any-wikipedia-royalty-three was King of the Franks from any-number to any-number	Pepin the Short	Pepin the Short or Pippin , often known as Pepin the Younger or Pepin III, was King of the Franks from 751 to 768.	King of the Franks
wikipedia-person	RELATIVES	any-wikipedia-person-one was born in any-wikipedia-settlement in any-date to any-wikipedia-ethnic-group-one actor any-wikipedia-person-two and his wife any-wikipedia-person-three an actress and daughter of any-wikipedia-ethnic-group-one statesman any-wikipedia-officeholder	Kiefer Sutherland	He was born in London, England in 1966 to Canadian actor Donald Sutherland and his wife Shirley Douglas, an actress and daughter of Canadian statesman Tommy Douglas.	Tommy Douglas
wikipedia-uk-place	METROPOLITAN-COUNTY	any-wikipedia-uk-place is a part of the any-wikipedia-settlement and is a part of the Black Country	Tipton	It is a part of the West Midlands conurbation, and is a part of the Black Country.	West Midlands
wikipedia-religious-building	STATUS	The any-wikipedia-religious-building or the 'Em peror's Mosque' was built in any-date by the any-wikipedia-former-monarchy any-wikipedia-royalty in any-wikipedia-settlement	Badshahi Mosque	The Badshahi Mosque , or the 'Emperor's Mosque', was built in 1673 by the Mughal Emperor Aurangzeb in Lahore, Pakistan.	Mosque
wikipedia-settlement	PUSHPIN-MAP	any-wikipedia-settlement is also the biggest city on the island of any-wikipedia-islands	Dublin	Dublin is also the biggest city on the island of Ireland.	Ireland
wikipedia-italian-comune	REGION	any-wikipedia-italian-comune-one is in the province of any-wikipedia-italian-comune-two in the south of any-wikipedia-region-of-italy	Gela	It is in the province of Caltanissetta in the south of Sicily.	Sicily
wikipedia-comedian	NATIONALITY	any-wikipedia-comedian is an Emmy Award-winning and Golden Globe-nominated Colombian\/Puerto Rican American comedian actor and producer	John Leguizamo	John Leguizamo is an Emmy Award-winning and Golden Globe-nominated Colombian/Puerto Rican American comedian, actor and producer.	American
wikipedia-vice-president	PARTY	any-wikipedia-vice-president was a member of the Republican Party and served with President William any-wikipedia-given-name any-wikipedia-river	James S. Sherman	Sherman was a member of the Republican Party, and served with President William Howard Taft.	Republican
wikipedia-person	PARENTS	any-wikipedia-person-one was born in any-wikipedia-settlement in any-date to any-wikipedia-ethnic-group-one actor any-wikipedia-person-two and his wife any-wikipedia-person-three an actress and daughter of any-wikipedia-ethnic-group-one statesman any-wikipedia-officeholder	Kiefer Sutherland	He was born in London, England in 1966 to Canadian actor Donald Sutherland and his wife Shirley Douglas, an actress and daughter of Canadian statesman Tommy Douglas.	Shirley Douglas
wikipedia-uk-place	MAP-TYPE	any-wikipedia-uk-place is a part of the any-wikipedia-settlement and is a part of the Black Country	Tipton	It is a part of the West Midlands conurbation, and is a part of the Black Country.	West Midlands
wikipedia-building	MAP-TYPE	any-wikipedia-building is a tall minaret in Iqbal Park any-wikipedia-settlement built in commemoration of the Lahore Resolution	Minar-e-Pakistan	Minar-e-Pakistan is a tall minaret in Iqbal Park Lahore, built in commemoration of the Lahore Resolution.	Lahore
wikipedia-italian-comune	REGION	any-wikipedia-italian-comune is a city in the Italian region of any-wikipedia-region-of-italy	Gela	Gela is a city in the Italian region of Sicily.	Sicily
wikipedia-royalty	ISSUE	any-wikipedia-royalty's sons any-wikipedia-royalty and any-wikipedia-person were each King of half the any-wikipedia-former-country after him	Pepin the Short	His sons, Charlemagne and Carloman, were each King of half the Kingdom of the Franks after him.	Carloman
wikipedia-building	LOCATION	any-wikipedia-building-one or any-wikipedia-building-two is a very tall skyscraper in any-wikipedia-settlement and is the world's tallest man made building ever built	Burj Khalifa	Burj Khalifa or "Khalifa Tower" is a very tall skyscraper in Dubai, United Arab Emirates and is the world's tallest man made building ever built.	Dubai, United Arab Emirates
wikipedia-person	BIRTH-PLACE	any-wikipedia-person-one was born in any-wikipedia-settlement in any-date to any-wikipedia-ethnic-group-one actor any-wikipedia-person-two and his wife any-wikipedia-person-three an actress and daughter of any-wikipedia-ethnic-group-one statesman any-wikipedia-officeholder	Kiefer Sutherland	He was born in London, England in 1966 to Canadian actor Donald Sutherland and his wife Shirley Douglas, an actress and daughter of Canadian statesman Tommy Douglas.	London, England
wikipedia-uk-place	MAP-TYPE	any-wikipedia-uk-place is a town in the Sandwell borough of the West Midlands, England with a population of around any-number	Tipton	Tipton is a town in the Sandwell borough of the West Midlands, England, with a population of around 47,000.	West Midlands
wikipedia-government-agency	TYPE	The any-wikipedia-government-agency is a any-wikipedia-album department of the United States government with the goal of protecting the health of all Americans and providing essential human services	United States Department of Health and Human Services	The United States Department of Health and Human Services , is a Cabinet department of the United States government with the goal of protecting the health of all Americans and providing essential human services.	Department
wikipedia-vice-president	TERM-END	any-wikipedia-vice-president was in office from any-date-one to any-date-two	James S. Sherman	He was in office from March 4, 1909 to October 30, 1912.	March 4, 1909
wikipedia-software	DEVELOPER	any-wikipedia-software is made by any-wikipedia-company	Adobe Illustrator	It is made by Adobe Systems.	Adobe Systems
wikipedia-italian-comune	PROVINCE	any-wikipedia-italian-comune-one is in the province of any-wikipedia-italian-comune-two in the south of any-wikipedia-region-of-italy	Gela	It is in the province of Caltanissetta in the south of Sicily.	Caltanissetta
wikipedia-football-biography	NATIONALTEAM	any-wikipedia-football-biography has played for the Brazil national team	Juninho Paulista	He has played for the Brazil national team.	Brazil
wikipedia-airport	PUSHPIN-MAP	any-wikipedia-airport served any-number passengers in any-date-one and any-number passengers in any-date-two, more than a half of total passengers in any-wikipedia-country's airports	Tan Son Nhat International Airport	It served 8.5 million passengers in 2006 and 11 million passengers in 2007, more than a half of total passengers in Vietnam's airports.	Vietnam
wikipedia-uk-place	REGION	any-wikipedia-uk-place is a town in the Sandwell borough of the West Midlands, England with a population of around any-number	Tipton	Tipton is a town in the Sandwell borough of the West Midlands, England, with a population of around 47,000.	West Midlands
wikipedia-person	PARENTS	any-wikipedia-person-one was born in any-wikipedia-settlement in any-date to any-wikipedia-ethnic-group-one actor any-wikipedia-person-two and his wife any-wikipedia-person-three an actress and daughter of any-wikipedia-ethnic-group-one statesman any-wikipedia-officeholder	Kiefer Sutherland	He was born in London, England in 1966 to Canadian actor Donald Sutherland and his wife Shirley Douglas, an actress and daughter of Canadian statesman Tommy Douglas.	Donald Sutherland
wikipedia-file-format	MIME	any-wikipedia-file-format is a computer file format for word processors presentation software and other computer programs	OpenDocument	OpenDocument Format is a computer file format for word processors, presentation software and other computer programs.	presentation
wikipedia-country	OFFICIAL-LANGUAGES	any-wikipedia-country is a member state of the African Union the any-wikipedia-geopolitical-organization-one the any-wikipedia-geopolitical-organization-two any-wikipedia-organization and the any-wikipedia-geopolitical-organization-three	Angola	Angola is a member state of the African Union, the Community of Portuguese Language Countries, the Latin Union, South Atlantic Peace and Cooperation Zone and the Southern African Development Community.	Portuguese
wikipedia-building	DEVELOPER	any-wikipedia-company said on any-date that construction of any-wikipedia-building was slowed because of changes to finishes	Burj Khalifa	Emaar Properties said on 9 June 2008 that construction of Burj Khalifa was slowed because of changes to finishes.	Emaar Properties
wikipedia-airport	CITY-SERVED	any-wikipedia-airport is an airport in any-wikipedia-settlement	Tan Son Nhat International Airport	Tan Son Nhat International Airport is an airport in Ho Chi Minh City, Vietnam.	Ho Chi Minh City, Vietnam
wikipedia-football-biography	NATIONALTEAM	any-wikipedia-football-biography has played for Brazil national team	Mauro Silva	He has played for Brazil national team.	Brazil
wikipedia-uk-place	REGION	any-wikipedia-uk-place is a part of the any-wikipedia-settlement and is a part of the Black Country	Tipton	It is a part of the West Midlands conurbation, and is a part of the Black Country.	West Midlands
wikipedia-grandslamtournaments	COUNTRY	any-wikipedia-grandslamtournaments is played in any-wikipedia-australian-place	Australian Open	It is played in Melbourne, Australia.	Australia
wikipedia-officeholder	PRESIDENT	any-wikipedia-officeholder-one took office on any-date-one under any-wikipedia-officeholder-two and any-wikipedia-officeholder-three's administrations until his retirement on any-date-two Prior to this Gates served for 26 any-number in the any-wikipedia-government-agency-one and the any-wikipedia-government-agency-two	Robert Gates	He took office on December 18, 2006 under George W. Bush and Barack Obama's administrations until his retirement on July 1, 2011 Prior to this, Gates served for 26 years in the Central Intelligence Agency and the United States National Security Council.	Barack Obama
wikipedia-country	POPULATION-ESTIMATE	any-wikipedia-country's population is estimated to be any-number	Angola	Angola's population is estimated to be 18,498,000 .	18,498,000
wikipedia-airport	PUSHPIN-MAP	any-wikipedia-airport is an airport in any-wikipedia-settlement	Tan Son Nhat International Airport	Tan Son Nhat International Airport is an airport in Ho Chi Minh City, Vietnam.	Vietnam
wikipedia-file-format	MIME	For example OpenOffice is a program that uses any-wikipedia-file-format to save text slideshows and spreadsheets	OpenDocument	For example, OpenOffice is a program that uses ODF to save text, slideshows and spreadsheets.	text
wikipedia-building	OPENING	any-wikipedia-building opened on any-date	Burj Khalifa	Burj Khalifa opened on 4 January 2010.	4 January 2010
wikipedia-grandslamtournaments	CITY	any-wikipedia-grandslamtournaments is played in any-wikipedia-australian-place	Australian Open	It is played in Melbourne, Australia.	Melbourne
wikipedia-video-game	PUBLISHER	any-wikipedia-video-game is an any-wikipedia-company videogame that belongs to the any-wikipedia-video-game-series	Need for Speed: Carbon	Need For Speed: Carbon is an Electronic Arts videogame that belongs to the Need for Speed series.	Electronic Arts
wikipedia-football-biography	NATIONALTEAM	any-wikipedia-football-biography has played for Brazil national team	Bebeto	He has played for Brazil national team.	Brazil
wikipedia-officeholder	PRESIDENT	Under President George H W Bush any-wikipedia-officeholder served as Director of Central Intelligence	Robert Gates	Under President George H. W. Bush, Gates served as Director of Central Intelligence.	George H. W. Bush
wikipedia-country	LARGEST-CITY	any-wikipedia-country is divided into any-number provinces and the capital city of any-wikipedia-settlement	Armenia	Armenia is divided into ten provinces and the capital city of Yerevan.	capital
wikipedia-book	AUTHOR	any-wikipedia-book is a book written by any-wikipedia-writer	Just Ella	Just Ella is a book written by Margaret Peterson Haddix.	Margaret Peterson Haddix
wikipedia-software	DEVELOPER	Many people can edit the document and also download to edit on their version of any-wikipedia-software	Microsoft Office 2010	Many people can edit the document and also download to edit on their version of Microsoft Office 2010.	Microsoft
wikipedia-building	HIGHEST-PREV	any-wikipedia-building-one was the tallest building until any-date before any-wikipedia-building-two was built	Burj Khalifa	Taipei 101 was the tallest building until 2010 before Burj Khalifa was built.	Taipei 101
wikipedia-university	STATE	any-wikipedia-university is a private university in Chestnut Hill, Massachusetts	Boston College	Boston College is a private university in Chestnut Hill, Massachusetts.	Massachusetts
wikipedia-swiss-town	CANTON	any-wikipedia-swiss-town-one is the capital of the Wahlkreis of any-wikipedia-swiss-town-one in the canton of St Gallen in any-wikipedia-country	Wil	Wil is the capital of the Wahlkreis of Wil in the canton of St. Gallen in Switzerland.	St. Gallen
wikipedia-video-game	SERIES	any-wikipedia-video-game is an any-wikipedia-company videogame that belongs to the any-wikipedia-video-game-series	Need for Speed: Carbon	Need For Speed: Carbon is an Electronic Arts videogame that belongs to the Need for Speed series.	Need for Speed
wikipedia-officeholder	TERM-START	any-wikipedia-officeholder-one took office on any-date-one under any-wikipedia-officeholder-two and any-wikipedia-officeholder-three's administrations until his retirement on any-date-two Prior to this Gates served for 26 any-number in the any-wikipedia-government-agency-one and the any-wikipedia-government-agency-two	Robert Gates	He took office on December 18, 2006 under George W. Bush and Barack Obama's administrations until his retirement on July 1, 2011 Prior to this, Gates served for 26 years in the Central Intelligence Agency and the United States National Security Council.	December 18, 2006
wikipedia-french-commune	DEPARTMENT	any-wikipedia-french-commune is a commune of the any-wikipedia-department departement in the southwestern part of any-wikipedia-country	Araujuzon	Araujuzon is a commune of the Pyrenees-Atlantiques departement in the southwestern part of France.	Pyrenees-Atlantiques
wikipedia-software	DEVELOPER	any-wikipedia-software-one will include any-wikipedia-software-two an online version of any-wikipedia-software-three	Microsoft Office 2010	It will include Microsoft Office Web Apps, an online version of Microsoft Office.	Microsoft
wikipedia-musical-artist	CURRENT-MEMBERS	any-wikipedia-musical-artist has written any-number songs	Dave Matthews Band	Dave Matthews Band has written 235 songs .	Dave Matthews
wikipedia-film	DIRECTOR	any-wikipedia-film-one was the any-ordinal movie in any-wikipedia-person's The any-wikipedia-film-two Trilogy	Batman Begins	Batman Begins was the first movie in Christopher Nolan's The Dark Knight Trilogy.	Christopher Nolan
wikipedia-swiss-town	CANTON	any-wikipedia-swiss-town-one is a municipality of the Wahlkreis of any-wikipedia-swiss-town-two in the canton of St Gallen in any-wikipedia-country	Uzwil	Uzwil is a municipality of the Wahlkreis of Wil in the canton of St. Gallen in Switzerland.	St. Gallen
wikipedia-athletic-conference	ASSOCIATION	any-wikipedia-athletic-conference-one officially abbreviated any-wikipedia-athletic-conference-two is a group of college sports teams that play each other on the NCAA Division I level	Conference USA	Conference USA, officially abbreviated C-USA, is a group of college sports teams that play each other on the NCAA Division I level.	NCAA
wikipedia-country	CAPITAL	any-wikipedia-country is divided into any-number provinces and the capital city of any-wikipedia-settlement	Armenia	Armenia is divided into ten provinces and the capital city of Yerevan.	Yerevan
wikipedia-royalty	SUCCESSOR	any-wikipedia-royalty's sons any-wikipedia-royalty and any-wikipedia-person were each King of half the any-wikipedia-former-country after him	Pepin the Short	His sons, Charlemagne and Carloman, were each King of half the Kingdom of the Franks after him.	Charlemagne and Carloman
wikipedia-vg	PLATFORMS	any-wikipedia-vg is only available for the PlayStation any-number	MotorStorm	It is only available for the PlayStation 3.	PlayStation 3
wikipedia-musical-artist	CURRENT-MEMBERS	any-wikipedia-musical-artist is a band from the any-wikipedia-country	Dave Matthews Band	Dave Matthews Band is a band from the United States.	Dave Matthews
wikipedia-royalty	SUCCESSION	any-wikipedia-royalty was King of any-wikipedia-country-one King of any-wikipedia-settlement Archduke of any-wikipedia-country-two and Holy Roman Emperor	Rudolf II, Holy Roman Emperor	Rudolf II was King of Hungary , King of Bohemia , Archduke of Austria , and Holy Roman Emperor .	King of Bohemia
wikipedia-person	NATIONALITY	Sir Maurice Joseph Micklewhite, Jr any-wikipedia-order known by the artistic name any-wikipedia-person is a popular any-wikipedia-language movie actor	Michael Caine	Sir Maurice Joseph Micklewhite, Jr. CBE , known by the artistic name Michael Caine, is a popular English movie actor.	English
wikipedia-football-biography	NATIONALTEAM	any-wikipedia-football-biography has played for any-wikipedia-country national team	David Bisconti	He has played for Argentina national team.	Argentina
wikipedia-athletic-conference	DIVISION	any-wikipedia-athletic-conference-one officially abbreviated any-wikipedia-athletic-conference-two is a group of college sports teams that play each other on the NCAA Division I level	Conference USA	Conference USA, officially abbreviated C-USA, is a group of college sports teams that play each other on the NCAA Division I level.	Division I
wikipedia-country	OFFICIAL-LANGUAGES	The Armenian name for any-wikipedia-country means any-wikipedia-film of Haik	Armenia	The Armenian name for Armenia means Land of Haik.	Armenian
wikipedia-officeholder	PRESIDENT	any-wikipedia-officeholder-one took office on any-date-one under any-wikipedia-officeholder-two and any-wikipedia-officeholder-three's administrations until his retirement on any-date-two Prior to this Gates served for 26 any-number in the any-wikipedia-government-agency-one and the any-wikipedia-government-agency-two	Robert Gates	He took office on December 18, 2006 under George W. Bush and Barack Obama's administrations until his retirement on July 1, 2011 Prior to this, Gates served for 26 years in the Central Intelligence Agency and the United States National Security Council.	George W. Bush
